recipe_name,ingredients_parsed,ingredients,recipe_urls
Sicilian-style tuna carpaccio,rose wine yellowfin tuna sustainably sourced lemon garlic,"['2 tablespoons capers', '4 tablespoons rosé wine', '1 long fresh red chilli', '1 x 200 g yellowfin tuna steak, sustainably sourced', '1 lemon', '½ a bunch of fresh basil', '½ a bunch of fresh dill', '1 small clove of garlic', 'extra virgin olive oil', 'rocket , to serve']",https://www.jamieoliver.com/recipes/fish-recipes/sicilian-style-tuna-carpaccio/
Asian seared tuna,yellowfin tuna sustainably sourced sesame sesame garlic soy lemon onion,"['1 x 200 g thick yellowfin tuna steak, sustainably sourced', '3 tablespoons sesame seeds', 'olive oil', 'sesame oil', '2 cloves of garlic', '2cm piece of fresh ginger', '1 tablespoon low-salt soy sauce', '½ lemon', '3 sprigs of fresh coriander', '1 spring onion', '1 fresh red chilli']",https://www.jamieoliver.com/recipes/fish-recipes/asian-seared-tuna/
Winter nights chilli,porcini mushroom butternut squash pork belly out brisket onion cannellini bean chickpea plum tomato salsa onion eating apple,"['20 g dried porcini mushrooms', '2 tablespoons fennel seeds', '2 tablespoons coriander seeds', '2 tablespoons smoked paprika', '1 butternut squash , (1.2kg)', 'olive oil', '1 kg higher-welfare pork belly , skin off, bone out', '1 kg brisket', '2 large onions', '150 ml balsamic vinegar', '2 x 400 g tins of cannellini beans , or chickpeas', '2 x 400 g tins of quality plum tomatoes', '4 mixed-colour peppers', '2–3 fresh red chillies', '1 bunch of fresh coriander , (30g)', 'SALSA', '1 red onion', '2 eating apples', '3 tablespoons cider vinegar', '3 tablespoons extra virgin olive oil']",https://www.jamieoliver.com/recipes/pork-recipes/winter-nights-chilli/
Shepherd's pie,lamb filling onion carrot celery swede flour side bottom mari piper potato butter cheddar cheese,"['ROAST LAMB', '1 small shoulder of lamb, bone in (2kg)', 'olive oil', 'FILLING', '4 red onions', '4 carrots', '4 sticks of celery', '1 medium swede', 'a few sprigs of fresh rosemary', '1 heaped tablespoon plain flour', 'TOPPING, SIDES & BOTTOM', '2.5 kg Maris Piper potatoes', '2 good knobs of unsalted butter', '100 g Cheddar cheese', '2 sprigs of fresh rosemary', '60 g fresh breadcrumbs']",https://www.jamieoliver.com/recipes/lamb-recipes/shepherd-s-pie/
Chicken Kyiv,bacon chicken breast got mine butcher but either way is flour egg sunflower spinach lemon butter garlic butter broccoli mash mari piper potato broccoli butter,"['4 rashers of smoked streaky bacon', 'olive oil', '4 x 150 g skinless chicken breasts , (I got mine from the butcher with the bone in, but either way is fine)', '3 tablespoons plain flour', '2 large free-range eggs', '150 g fresh breadcrumbs', 'sunflower oil', '2 large handfuls of baby spinach , or rocket', '2 lemons', 'BUTTER', '4 cloves of garlic', '½ a bunch of fresh flat-leaf parsley (15g)', '4 knobs of unsalted butter , (at room temperature)', '1 pinch of cayenne pepper', 'BROCCOLI MASH', '800 g Maris Piper potatoes', '1 head of broccoli', '1 knob of unsalted butter']",https://www.jamieoliver.com/recipes/chicken-recipes/chicken-kyiv/
Next-level steak & onion sandwich,flank skirt steak bavette onion butter sugar wine ciabatta,"['400 g flank skirt steak or bavette', '2 large onions', '20 g unsalted butter', 'olive oil', '70 g dark brown sugar', '125 ml red wine vinegar', '1 ciabatta loaf', 'extra virgin olive oil', 'English mustard , optional', '1 handful of watercress']",https://www.jamieoliver.com/recipes/beef-recipes/next-level-steak-onion-sandwich/
Lobster mac 'n' cheese,live lobster onion garlic butter fillet burgundy pouilly flour semi skimmed milk amori pasta macaroni mature cheddar cheese cheese parmesan cheese,"['1 x 1.5 kg whole live lobster , (or 2 small ones)', '2 onions', '4 cloves of garlic', '50 g unsalted butter', '1 small pinch of saffron', '½ teaspoon cayenne pepper', '2 anchovy fillets', '200 ml white Burgundy , such as Pouilly-Fuissé', '50 g plain flour', '1.1 litres semi-skimmed milk', '2 teaspoons English mustard', '400 g dried amori pasta , or macaroni', '70 g mature Cheddar cheese', '70 g Gruyère cheese', '70 g Parmesan cheese']",https://www.jamieoliver.com/recipes/pasta-recipes/lobster-mac-n-cheese/
Bolognese ravioli,filling minced pork minced veal beef garlic onion carrot celery chianti classico plum tomato parmesan cheese pasta royal pasta dough semolina garlic plum tomato,"['FILLING', '400 g higher-welfare minced pork', '400 g higher-welfare minced veal , or beef', 'olive oil', '2 cloves of garlic', '2 onions', '2 carrots', '2 sticks of celery', '200 ml Chianti Classico', '2 x 400 g tins of quality plum tomatoes', '100 g Parmesan cheese , plus extra to serve', 'PASTA', '1 x Royal pasta dough', 'fine semolina', 'SAUCE', '4 cloves of garlic', '1-2 fresh red chillies', '3 x 400 g tins of quality plum tomatoes', 'a few sprigs of fresh basil']",https://www.jamieoliver.com/recipes/pasta-recipes/bolognese-ravioli/
Insanity burger,minced chuck steak onion wine gherkin sesame topped brioche burger bun bacon american tabasco chipotle leicester cheese tomato burger an iceberg lettuce mayo tomato tabasco chipotle brandy bourbon,"['800 g higher-welfare minced chuck steak', 'olive oil', '1 large red onion', '1 splash of white wine vinegar', '2 large gherkins', '4 sesame-topped brioche burger buns', '4-8 rashers of higher-welfare smoked streaky bacon', '4 teaspoons American mustard', 'Tabasco Chipotle sauce', '4 thin slices of Red Leicester cheese', '4 teaspoons tomato ketchup', 'BURGER SAUCE', '¼ of an iceberg lettuce', '2 heaped tablespoons free-range mayo', '1 heaped tablespoon tomato ketchup', '1 teaspoon Tabasco Chipotle sauce', '1 teaspoon Worcestershire sauce', '1 teaspoon brandy , or bourbon (optional)']",https://www.jamieoliver.com/recipes/beef-recipes/insanity-burger/
"Puy lentil, parsnip & walnut salad",parnsips vegetable stock puy lentil walnut walnut wine tsp tsp shallot garlic shaving vegetarian hard cheese,"['6 parnsips', '1 litre vegetable stock', '250 g puy lentils', '1 bay leaf', '50 g walnuts', '2 tbsp olive oil', 'For the dressing:', '3 tbsp walnut oil', '1 tbsp red wine vinegar', '2 tsp runny honey', '1/2 tsp Dijon mustard', '1 shallot', '1/2 clove of garlic', 'a large bunch of watercress , or rocket leaves', 'a few shavings of vegetarian hard cheese , to serve']",https://www.jamieoliver.com/recipes/vegetables-recipes/puy-lentil-parsnip-walnut-salad/
Vegan beetroot Carpaccio,beetroot mixture look wonderful lemon onion caster sugar,"['8 medium beetroots , a mixture of colours looks wonderful', '2 lemons', '½ a bunch of fresh dill , (15g)', '1 red onion', '2 teaspoons caster sugar', '2 tablespoons olive oil', '1 tablespoon capers , drained and rinsed']",https://www.jamieoliver.com/recipes/vegetables-recipes/vegan-beetroot-carpaccio/
"Vegan mushroom, chestnut & cranberry tart",gluten flour xanthan gum dairy margarine vegetable onion garlic carrot mushroom soya cream cheese mushroom garlic cranberry redcurrant walnut garlic redcurrant jelly vegetable stock cornflour floury potato,"['230 g gluten-free plain flour', '½ teaspoon xanthan gum', '60 g dairy-free margarine', '60 g vegetable shortening', 'Filling:', '1 large onion', '2 cloves of garlic', '5-6 carrots , (450g)', '250 g chestnut mushrooms', '360 g peeled chestnuts', 'olive oil', '1 teaspoon dried thyme', '225 g soya cream cheese', '250 g wild mushrooms', '½ a bunch of fresh flat-leaf parsley , (15g)', '2 tablespoons garlic oil', '2 tablespoons dried cranberries', 'Redcurrant gravy:', '1 tablespoon walnut oil , or garlic oil', '1 tablespoon redcurrant jelly', '300 ml hot vegetable stock', '1 heaped tablespoon cornflour , mixed with 2 tbsp water', 'Roast potatoes:', '2.5 kg floury potatoes', 'groundnut oil , or olive oil']",https://www.jamieoliver.com/recipes/vegetables-recipes/vegan-mushroom-chestnut-cranberry-tart/
"Gluten-free parsnip, pork & apple stuffing",onion parsnip eating apple gluten sausage gluten bread egg lemon,"['olive oil', '2 onions', 'a few sprigs of fresh sage', '4 parsnips', '2 eating apples', '1 splash of cider', '8 gluten-free sausages', '200 g gluten-free bread', '1 large free-range egg', '1 lemon']",https://www.jamieoliver.com/recipes/pork-recipes/gluten-free-parsnip-pork-apple-stuffing/
Vegetarian nut roast,pistachio linseed sunflower puree gluten vegetarian suet maple syrup gluten flour blue cheese topping potato rapeseed butter mushroom creme fraiche dorset blue vinny vegetarian blue cheese linseed pistachio sunflower,"['50 g shelled pistachios', '50 g linseed', '50 g sunflower seeds', '100 g chestnut purée', '50 g gluten-free vegetarian suet', '1 tablespoon maple syrup', 'gluten-free flour , for dusting', 'BLUE CHEESE TOPPING', '400 g sweet potato', 'rapeseed oil', '20 g unsalted butter', '250 g chestnut mushrooms', '100 g crème fraîche', '1 good pinch of ground nutmeg', '75 g Dorset Blue Vinny , or vegetarian blue cheese', '1 teaspoon linseed', '1 teaspoon shelled pistachios', '1 teaspoon sunflower seeds']",https://www.jamieoliver.com/recipes/vegetables-recipes/vegetarian-nut-roast/
Vegan nut roast,decorating linseed sunflower puree gluten vegetarian suet maple syrup gluten flour spinach mushroom rapeseed spinach chopped spinach cracked avocado silken tofu squeeze lemon potato,"['50 g pine nuts , plus extra for decorating', '50 g linseed', '50 g sunflower seeds', '100 g unsweetened chestnut purée', '50 g gluten-free vegetarian suet', '1 tablespoon maple syrup', 'gluten-free flour , for dusting', 'Spinach topping:', '300 g chestnut mushrooms', 'rapeseed oil', '260 g baby leaf spinach , or frozen chopped spinach', '1 teaspoon cracked black pepper', '1 ripe avocado', '100 g silken tofu', '1 pinch of ground nutmeg', '1 squeeze of lemon juice', '¼ of a sweet potato', 'olive oil']",https://www.jamieoliver.com/recipes/vegetables-recipes/vegan-nut-roast/
Bumble-O,onion rapeseed polenta sorghum flour buckwheat flour tsp gluten tsp onion egg milk onion marmalade onion chutney mature cheddar cheese blue cheese tsp,"['1 red pepper', '1 red onion', 'rapeseed oil', '100 g polenta', '80 g sorghum flour , (see tip)', '40 g buckwheat flour', '2½ tsp gluten-free baking powder', '½ tsp black onion seeds', '45 g capers', '2 large free-range eggs', '150 ml whole milk', '150 g corn oil', 'Topping:', '160 g onion marmalade , or sweet onion chutney', '230 g mature cheddar cheese', '75 g blue cheese', '1 tsp dried basil']",https://www.jamieoliver.com/recipes/cheese-recipes/bumble-o/
Gluten-free pizza,semi skimmed milk sachet yeast caster sugar gluten bread flour xanthan gum egg bicarbonate topping garlic plum tomato ball buffalo mozzarella,"['250 ml semi-skimmed milk', '1 x 7 g sachet of dried yeast', '2½ teaspoons caster sugar', '400 g gluten-free bread flour , plus extra for dusting', '1 teaspoon xanthan gum', '1 teaspoon fine sea salt', '1 large free-range egg', 'olive oil', '½ teaspoon bicarbonate of soda', '2 teaspoons cider vinegar', 'TOPPING', '½ a bunch of fresh basil , (15g)', '1 clove of garlic', '1 x 400 g tin of plum tomatoes', '2 x 125 g balls of buffalo mozzarella']",https://www.jamieoliver.com/recipes/bread-recipes/gluten-free-pizza/
Vegan dim sum buns,garlic mushroom shiitake rice wine soy onion sesame coconut milk self raising flour filled coconut milk sesame hoisin,"['2 cloves of garlic', '1 thumb-sized piece of fresh ginger', '½ a bunch of fresh coriander , (15g)', 'groundnut oil', '450 g mixed mushrooms , such as shiitake and chestnut', '2 tablespoons rice wine vinegar', '2 tablespoons sweet chilli sauce', '2 tablespoons low-salt soy sauce', '4 spring onions', '1 fresh red chilli', 'sesame oil', '1 x 400 g tin of light coconut milk', '500 g self-raising flour , or 2 filled coconut milk tins of flour, plus extra for dusting', '2 tablespoons sesame seeds', 'hoisin sauce , to serve']",https://www.jamieoliver.com/recipes/vegetables-recipes/vegan-dim-sum-buns/
Vegan shepherd's pie,mari piper potato potato dairy margarine use butter margarine not onion carrot garlic celery mushroom tomato vegan wine regular wine not vegetable stock lentil chickpea lemon,"['600 g Maris Piper potatoes', '600 g sweet potatoes', '40 g dairy-free margarine , (or use butter or margarine if you’re not vegan)', '1 onion', '2 carrots', '3 cloves of garlic', '2 sticks of celery', '1 tablespoon coriander seeds', 'olive oil', '½ a bunch of fresh thyme , (10g)', '350 g chestnut mushrooms', '12 sun-dried tomatoes', '2 tablespoons balsamic vinegar', 'vegan red wine , (or regular red wine if you’re not vegan), optional', '100 ml vegetable stock', '1 x 400 g tin of lentils', '1 x 400 g tin of chickpeas', '5 sprigs of fresh flat-leaf parsley', '2 sprigs of fresh rosemary', '1 lemon', '30 g fresh breadcrumbs']",https://www.jamieoliver.com/recipes/vegetables-recipes/vegan-shepherd-s-pie/
Vegan mac ‘n’ cheese,macaroni onion soya milk dairy margarine flour nutritional yeast vegan cheese specialist garlic,"['350 g dried macaroni', 'sea salt', 'freshly ground black pepper', '1 onion', '1 litre unsweetened organic soya milk', '100 g dairy-free margarine', '85 g plain flour', '1 heaped teaspoon English mustard', '1½ tablespoons nutritional yeast flakes', '50 g vegan cheese , optional (available from specialist stores)', '5 cloves of garlic', '½ a bunch of fresh thyme', 'olive oil', '40 g fresh breadcrumbs']",https://www.jamieoliver.com/recipes/pasta-recipes/vegan-mac-n-cheese/
The best vegan burger,chickpea sweetcorn lemon flour rapeseed lettuce tomato tomato wholemeal burger bun,"['1 x 400 g tin of chickpeas', '1 x 340 g tin of sweetcorn', '½ a bunch of fresh coriander , (15g)', '½ teaspoon paprika', '½ teaspoon ground coriander', '½ teaspoon ground cumin', '1 lemon', '3 heaped tablespoons plain flour , plus extra for dusting', 'rapeseed oil', '1 small round lettuce', '2 large ripe tomatoes', 'tomato ketchup', '4 wholemeal burger buns']",https://www.jamieoliver.com/recipes/vegetables-recipes/the-best-vegan-burger/
My special vegan kofte,garlic courgette chickpea minty yoghurt dip cucumber soya yoghurt lemon nutty onion garlic cashew coconut milk smooth peanut butter,"['1 teaspoon coriander seeds', '1 teaspoon cumin seeds', '5 cm piece of ginger', '2 cloves of garlic', 'olive oil', '2 courgettes', '1 big bunch of fresh coriander , (60g)', '1 x 400 g tin of chickpeas', '40 g fine breadcrumbs', 'MINTY YOGHURT DIP', '½ a cucumber', '3 sprigs of fresh mint', '4 tablespoons organic soya yoghurt', '1 lemon', 'NUTTY SAUCE', '1 small onion', '1 clove of garlic', '100 g cashew nuts', '140 ml light coconut milk', '2 tablespoons smooth peanut butter']",https://www.jamieoliver.com/recipes/vegetables-recipes/my-special-vegan-kofte/
Malaysian beef curry,shallot garlic galangal paste lemongrass lime vegetable beef topside coconut milk,"['20 small red shallots', '6 cloves of garlic', '8 long fresh red chillies', '15 g fresh turmeric', '40 g fresh ginger', '15 g galangal', '1 tbsp ground turmeric', '30 g tamarind paste', '2 lemongrass stalks', '4 lime leaves', 'vegetable oil', '1 kg beef topside', '500 ml coconut milk', '1 small fresh red chilli']",https://www.jamieoliver.com/recipes/beef-recipes/malaysian-beef-curry/
Basil gnudi,ricotta parmesan cheese egg egg yolk flour semolina flour butter unwaxed lemon cheese,"['2 large bunches of basil , (60g)', '250 g fresh ricotta', '125 g Parmesan cheese', '2 large free-range eggs', '1 free-range egg yolk', '75 g plain flour , plus a little extra', 'semolina flour , for dusting', '15 g butter', '1 unwaxed lemon', '30 g grated pecorino cheese , to serve']",https://www.jamieoliver.com/recipes/pasta-recipes/basil-gnudi/
Roast carrot & fennel soup,carrot onion garlic vegetable stock single cream flatbread strong bread flour fast action yeast sugar,"['1 kg carrots', '1 onion', '2 bulbs of fennel', 'olive oil', '2 cloves of garlic', '1.6 litres organic vegetable stock', '100 ml single cream', 'FLATBREADS', '1 teaspoon fennel seeds', '250 g strong bread flour', '½ teaspoon fast-action dried yeast', '1 teaspoon sugar']",https://www.jamieoliver.com/recipes/vegetables-recipes/roast-carrot-fennel-soup/
Wholewheat ravioli with courgette flowers & ricotta,tipo flour wholewheat flour egg filling courgette flower ricotta tomato young cheese,"['200 g Tipo 00 flour , plus extra for dusting', '100 g wholewheat flour', '3 large free-range eggs', 'filling', '20 courgette flowers', '250 g good-quality ricotta', 'a few sprigs of fresh mint', '1 small fresh red chilli', 'sauce', '600 g ripe tomatoes', '½ a bunch of fresh basil , (15g)', 'extra virgin olive oil', 'young pecorino cheese , to serve']",https://www.jamieoliver.com/recipes/pasta-recipes/wholewheat-ravioli-with-courgette-flowers-ricotta/
Hit ‘n’ run traybaked chicken,tomato onion chicken thigh out garlic,"['4 large ripe tomatoes', '2 red onions', '1 red pepper', '1 yellow pepper', '6 free-range chicken thighs , skin off, bone out', '4 cloves of garlic', '½ a bunch of fresh thyme', '1 teaspoon smoked paprika', 'olive oil', '2 tablespoons balsamic vinegar']",https://www.jamieoliver.com/recipes/chicken-recipes/hit-n-run-traybaked-chicken/
Winter squash penne,pasta vegetable stock butternut squash end onion chickpea penne parmesan cheese salad tomato cucumber onion co lettuce avocado feta cheese,"['PASTA', '1 organic vegetable stock cube', '1 butternut squash , (neck end only)', '1 onion', '1 teaspoon fennel seeds', '1 small dried red chilli', '½ a bunch of fresh sage , (15g)', '1 X 400 g tin of chickpeas', '320 g dried penne', '20 g parmesan cheese , plus extra to serve', '½ bunch of fresh flat-leaf parsley , (15g)', 'Salad', '3 ripe tomatoes', '½ cucumber', '4 spring onions', '2 little cos lettuces', '½ bunch of fresh mint , (15g)', '1 ripe avocado', '2 tablespoons extra virgin olive oil', '2 tablespoons balsamic vinegar', '20 g feta cheese']",https://www.jamieoliver.com/recipes/vegetables-recipes/butternut-pumpkin-penne-mint-avocado-chopped-salad/
Candied beet salad,golden candy cane beetroot both tsp butter orange tsp golden caster sugar salad buttermilk buttermilk lemon tarragon chopped,"['750 g golden or candy cane beetroot , or a mix of both', '50 g mixed seeds', 'Extra virgin olive oil', '1/2 tsp sweet smoked paprika', '2 knobs of unsalted butter', 'Zest and juice of 1 orange', '1/4 tsp ground cinnamon', '150 g golden caster sugar', '2 handfuls of salad leaves', 'Buttermilk dressing', '75 ml buttermilk', 'Juice of 1 lemon', '1/2 bunch of mixed soft herbs , such as chervil, tarragon and mint, leaves picked and chopped']",https://www.jamieoliver.com/recipes/vegetables-recipes/candied-beet-salad/
Ginger & honey chicken wings,chicken wing marinade onion soy,"['24 chicken wings', 'Ginger and honey marinade', '5 spring onions', '1 fresh red chilli', '5 tablespoons runny honey', '2 tablespoons soy sauce', '2 cm piece of ginger', '5 sprigs of fresh thyme']",https://www.jamieoliver.com/recipes/chicken-recipes/ginger-honey-chicken-wings/
Rigatoni with roasted tomatoes & ricotta salata,vine tomato garlic wine rigatoni ricotta salata cheese,"['1.5 kg vine tomatoes', '4 cloves of garlic', '3 fresh bay leaves', '5 fresh thyme sprigs', '1 splash of red wine vinegar', '400 g dried rigatoni', 'extra virgin olive oil', '80 g ricotta salata cheese', 'optional: ½ a bunch of fresh basil (15g)']",https://www.jamieoliver.com/recipes/pasta-recipes/rigatoni-with-roasted-tomatoes-ricotta-salata/
Potato & cauliflower curry,vegetable onion garlic chopped chipped tomato curry tumeric mari piper potato any other floury potato thickly cauliflower just larger than potato greek yogurt parathas chapati flour butter,"['3 tablespoons vegetable oil', '2 onions , sliced', '4 cloves of garlic , chopped', '6cm piece of ginger , peeled and chipped', '1 teaspoon mustard seeds', '1 teaspoon cumin seeds', '3 tomatoes , grated', '6 curry leaves', '1 teaspoon ground coriander', '1 teaspoon ground cumin', '1 teaspoon ground tumeric', '½ teaspoon cayenne pepper', '1 kg maris piper potatoes , or any other floury potatoes thickly diced', '1-2 green chillies , deseeded and sliced', '1 large cauliflower , cut into florets just larger than the potato', 'Greek-style yogurt , to serve', 'PARATHAS', '300 g chapati flour , plus extra for dusting', '2 tablespoons butter , melted']",https://www.jamieoliver.com/recipes/vegetables-recipes/potato-cauliflower-curry/
Apple & celeriac soup,onion celery celeriac orange pippin apple vegetable chicken stock creme fraiche hazelnut horseradish,"['4 tbsp olive oil', '2 onions', '1 celery stalk', '1 celeriac', ""4 Cox's Orange Pippin apples"", 'a few sprigs of thyme', '2 litres vegetable or chicken stock', '200 ml crème fraîche', 'a few sage leaves', 'toasted hazelnuts or grated fresh horseradish , to serve']",https://www.jamieoliver.com/recipes/vegetables-recipes/apple-celeriac-soup/
Achiote recado pork,pork chop achiote recado annatto onion garlic unpeeled allspice thread ancho other mexican lime orange fried onion ring flour vegetable deep onion,"['6 higher-welfare pork chops', 'Achiote recado', '2 tablespoons annatto seeds', '1 onion', '4 cloves of garlic , unpeeled', '1 tablespoon ground allspice', '1 tablespoon coriander seeds', '1 tablespoon ground cinnamon', '1 tablespoon cumin seeds', '1 tablespoon dried oregano', '1 teaspoon saffron threads', '2 tablespoons ancho chilli powder , or other Mexican chilli powder', '2 limes', '200 ml orange juice', '50 ml cider vinegar', 'Chilli-fried onion rings', '6 tablespoons flour', '6 tablespoons chilli powder , or paprika', 'vegetable oil , for deep frying', '2 large onions']",https://www.jamieoliver.com/recipes/pork-recipes/achiote-recado-pork/
Spinach & ricotta cannelloni,spinach onion garlic plum tomato lemon egg parmesan cheese ricotta cannelloni about tube mozzarella ball,"['400 g spinach', 'extra-virgin olive oil', '¼ teaspoon ground nutmeg', '1 onion', '2 cloves of garlic', '2 x 400 g tins of quality plum tomatoes', '1 bay leaf', '½ a bunch of fresh basil , (15g)', '½ a lemon', '1 large free-range egg', 'Parmesan cheese', '250 g ricotta', '150 g cannelloni , about 14 tubes', '2 x 125 g mozzarella balls']",https://www.jamieoliver.com/recipes/pasta-recipes/spinach-ricotta-cannelloni/
Pomegranate & chicken stew,chicken jointed tsp onion garlic tomato passata pomegranate molasses pomegranate pomegranate,"['olive oil', '1 higher-welfare whole chicken , jointed', '1 tsp paprika', '2 onions', '4 cloves of garlic', '1 red chilli', 'a few sprigs of fresh coriander', '300 ml tomato passata', '4 tbsp pomegranate molasses', '200 ml pomegranate juice', 'pomegranate seeds']",https://www.jamieoliver.com/recipes/chicken-recipes/pomegranate-chicken-stew/
Rabbit pie,shallot duck goose pork belly semi prune garlic pork mince armagnac pistachio rabbit thigh deboned pastry flour lard egg jelly sachet gelatine chicken stock butter greasing,"['3 shallots', '1 tablespoon duck or goose fat', '250 g higher-welfare pork belly', '6-8 semi-dried prunes', '1 clove of garlic', 'a few sprigs of fresh thyme', '450 g higher-welfare pork mince', '1 tablespoon Armagnac', '1 tablespoon pistachio nuts', '4 rabbit thighs , deboned', 'Hot-water crust pastry', '450 g flour', '170 g lard', '1 large free-range egg', 'Jelly', '1 sachet of gelatine', '800 ml chicken stock', '20 g butter , softened, plus extra for greasing']",https://www.jamieoliver.com/recipes/game-recipes/rabbit-pie/
Kerryann's cheesy potato pie,baked bean mari piper potato king edward butter semi skimmed milk cheddar cheese you want pimp you will need onion garlic tomato,"['2 x 400 g tins of baked beans', 'sea salt', 'freshly ground black pepper', '1.5 kg Maris Piper potatoes , or King Edward potatoes, peeled', '1 large knob of unsalted butter', '100 ml semi-skimmed milk', '1 whole nutmeg , for grating', '150 g Cheddar cheese', 'If you want to pimp your beans, you will need', '1 large onion , peeled', '2 cloves of garlic , peeled', '2 red peppers , deseeded', '1-2 fresh red chillies', 'olive oil', '2 sprigs of fresh thyme , leaves picked', '3 large ripe tomatoes']",https://www.jamieoliver.com/recipes/vegetables-recipes/kerryann-s-cheesy-potato-pie/
DJ BBQ's world's best meatloaf,carrot beef mince pork mince garlic old stale egg cheddar cheese bbq tomato tabasco onion,"['1 medium carrot , peeled', '400 g beef mince', '400 g higher-welfare pork mince', '1 clove of garlic , peeled and crushed', '1 teaspoon Old Bay seasoning , or 2 fresh bay leaves, crushed', '2 teaspoon Worcestershire sauce', '100 g stale breadcrumbs', '1 teaspoon sea salt', '1 teaspoon freshly ground black pepper', '2 large free-range eggs', '150 g Cheddar cheese , optional', 'For the sauce', '100 ml BBQ sauce', '50 ml tomato ketchup', 'Tabasco sauce', 'chili sauce', '1 large onion', '1 green pepper , deseeded']",https://www.jamieoliver.com/recipes/beef-recipes/dj-bbq-s-world-s-best-meatloaf/
Kerryann’s chilli con veggie,onion garlic leek tomato puree lentil lentil kidney bean bean chopped tomato vegetable stock,"['2 medium onions', '4 cloves of garlic', '1 medium leek', '1 long fresh red chilli', '2 tablespoons olive oil', '2 tablespoons ground cumin', '2 tablespoons ground coriander', '2 tablespoons smoked paprika', '½ a cinnamon stick , or 1 teaspoon ground cinnamon', '2 tablespoons dried oregano', '1 whole nutmeg , for grating', '2 tablespoons tomato purée', '250 g dried green lentils', '250 g dried red lentils', '2 x 400 g tins of red kidney beans', '2 x 400 g tins of black beans', '2 x 400 g tins of chopped tomatoes', '1.2 litres vegetable stock']",https://www.jamieoliver.com/recipes/vegetables-recipes/kerryann-s-chilli-con-veggie/
