recipe_name,ingredients_parsed,ingredients,recipe_urls
Oozy courgette risotto,onion garlic celery butter courgette vegetable stock hard cheese arborio rice wine ball buffalo mozzarella,"['1 large onion', '1 large clove of garlic', '2 sticks of celery', '1 knob of unsalted butter', 'olive oil', '2 small courgettes (300g)', '800 ml organic vegetable stock', '1 bunch of fresh basil', '40 g Italian hard cheese', '300 g arborio rice', '200 ml white wine , optional', '1 fresh red chilli', '2 x 125 g balls of buffalo mozzarella']",https://www.jamieoliver.com/recipes/rice-recipes/oozy-courgette-risotto/
Wine-braised chicken,chicken onion carrot garlic flour wine chicken stock potato grape,"['olive oil', '1 x 1.5 kg whole free-range chicken', '4 onions', '4 carrots', '2 cloves of garlic', '½ a bunch of fresh rosemary', '1 heaped tablespoon plain flour', '300 ml white wine', '200 ml organic chicken stock', '600 g potatoes', '2 handfuls of red and green grapes', 'a few sprigs of fresh flat-leaf parsley']",https://www.jamieoliver.com/recipes/chicken-recipes/wine-braised-chicken-with-roasted-grapes/
Quail & sausage skewers with celeriac,celeriac butter cumberland sausage quail sourdough garlic pear skewer bacon winter swiss chard cavolo nero lemon greek yoghurt creme fraiche,"['1 large celeriac', '2 knobs of butter', '2 sprigs of fresh thyme', 'olive oil', '3 quality cumberland sausages', '3 quail , (see tip)', '10 fresh bay leaves', '⅓ loaf of sourdough', '8 cloves of garlic', '1 pear', '4 long rosemary sprigs or skewers', '1 whole nutmeg , for grating', '4 thick rashers of higher-welfare smoked streaky bacon', 'runny honey', 'balsamic vinegar', '4 large handfuls of winter greens, such as Swiss chard or cavolo nero', 'extra virgin olive oil', '½ a lemon', '3 tablespoons Greek yoghurt or crème fraîche']",https://www.jamieoliver.com/recipes/pork-recipes/quail-sausage-skewers-with-celeriac/
"Roast duck leg, cherry, watercress & feta salad",duck feta cheese vinaigrette plum,"['2 duck legs', '250 g cherries', '100 g watercress', '150 g feta cheese', 'VINAIGRETTE', '1 tablespoon extra virgin olive oil', '1 teaspoon extra virgin plum seed oil , (see note)', '1 tablespoon balsamic vinegar']",https://www.jamieoliver.com/recipes/duck-recipes/roast-duck-leg-cherry-watercress-amp-feta-salad/
Beautiful lamb shanks,ancho raisin apple lamb shank onion garlic plum tomato chicken stock wine,"['2-3 smoked ancho chillies', '1 large handful of raisins', '285 ml unsweetened apple juice', '4 lamb shanks', 'olive oil', '3 red onions', '8 cloves of garlic', '2-3 fresh red chillies', '1 heaped teaspoon smoked paprika', '3 fresh bay leaves', '2-4 sprigs of fresh rosemary', '1 x 400 g tin of quality plum tomatoes', '750 ml organic chicken stock , optional', 'red wine vinegar']",https://www.jamieoliver.com/recipes/lamb-recipes/beautiful-lamb-shanks/
Pork afelia,onion garlic pork wine passata kefalotiri parmesan cheese,"['1 onion', '2-3 garlic cloves', '2 tablespoons coriander seeds', '4 tablespoons olive oil', '1.5 kg higher-welfare pork shoulder , cut into 5cm pieces', '375 ml dry red wine', '200 ml passata', 'kefalotiri or Parmesan cheese']",https://www.jamieoliver.com/recipes/pork-recipes/pork-afelia/
Gurkha chicken curry,chicken thigh onion potato tomato vegetable marinade garlic lemon yoghurt,"['8 large free-range chicken thighs , skin on, bone in', '1 large onion', '3 potatoes', '4 large ripe tomatoes', '½ a bunch of fresh coriander , (15g)', 'vegetable oil', '1 stick of cinnamon', '4 cloves', '1 teaspoon cumin seeds', '3 fresh bay leaves', '1 teaspoon ground turmeric', '1 tablespoon ground coriander', '1 fresh red chilli , (optional)', 'MARINADE', '5 cm piece of ginger', '1 bulb of garlic', '1 teaspoon fennel seeds', '5 cardamom pods', '1 teaspoon hot chilli powder', '1 lemon', '250 ml fat-free natural yoghurt']",https://www.jamieoliver.com/recipes/chicken-recipes/gurkha-chicken-curry/
Rabbit ragu,pancetta celery leek carrot onion garlic pork prosciutto deboned wine vegetable stock tagliolini mascarpone cheese lemon butter parmesan cheese pangrattato garlic,"['35 g pancetta', '2 stalks of celery', '1 small leek', '1 carrot', '1 onion', '2 cloves of garlic', '½ a bunch of fresh parsley', '30 g pork fat', '35 g prosciutto fat', '1 x 700 g wild rabbit, deboned and diced (about 450g meat)', '1 fresh bay leaf', '½ a small bunch of fresh sage', '2 sprigs of fresh rosemary', '90 ml white wine', '1 fresh red chilli', '500 ml organic vegetable stock', '500 g tagliolini', '4 tablespoons mascarpone cheese', '1 lemon', '20 g butter', '40 g Parmesan cheese', 'PANGRATTATO', 'olive oil', '1 clove of garlic', '50 g breadcrumbs']",https://www.jamieoliver.com/recipes/game-recipes/rabbit-ragu/
Broccoli soup,garlic celery broccoli chicken vegetable stock you afford ricotta cheese,"['1 clove of garlic', '2 sticks of celery', '400 g broccoli', '½ a bunch of fresh mint', 'olive oil', '1 litre chicken or vegetable stock cube , organic if you can afford', 'ricotta cheese']",https://www.jamieoliver.com/recipes/vegetables-recipes/broccoli-soup/
Pasta with aubergine & tomato sauce,onion garlic aubergine chopped tomato rigatoni ricotta cheese,"['1 small onion', '2 cloves of garlic', '½ a bunch of fresh basil', '2 aubergines', '4-6 tablespoons olive oil', '1 x 400 g tin of quality chopped tomatoes', '500 g dried rigatoni', '80 g ricotta cheese']",https://www.jamieoliver.com/recipes/pasta-recipes/pasta-with-aubergine-tomato-sauce/
Beef brisket with red wine & shallots,shallot garlic brisket beef rolled tied chopped tomato tomato puree wine wine,"['12 shallots', '6 cloves of garlic', '2 tablespoons extra virgin olive oil', '1.5 kg brisket of beef , rolled and tied', '1 whole nutmeg , for grating', '1 x 400 g tin of chopped tomatoes', '2 tablespoons tomato purée', '250 ml red wine', '2 fresh bay leaves', '1 stick of cinnamon', '1 small handful of black olives', '1 teaspoon dried oregano', 'a few sprigs of fresh thyme', '2 tablespoons red wine vinegar']",https://www.jamieoliver.com/recipes/beef-recipes/beef-brisket-with-red-wine-shallots/
Spiced parsnip & lentil soup with chilli oil,ham hock onion parsnip rogan josh paste lentil vegetable stock greek yoghurt garlic,"['1 small smoked higher-welfare ham hock', '1 onion', '3cm piece of ginger', '400 g parsnips', 'olive oil', '2 tablespoons rogan josh paste', '250 g red lentils', '1.6 litres organic vegetable stock , (optional)', 'a few sprigs of fresh mint', 'fat-free Greek yoghurt', 'CHILLI OIL', '3 tablespoons groundnut oil', '1 garlic clove', '2 red chillies']",https://www.jamieoliver.com/recipes/vegetables-recipes/spiced-parsnip-amp-lentil-soup-with-chilli-oil/
"Hake with braised artichokes, peas & bacon",shallot violet artichoke bacon chicken stock pea hake lemon,"['olive oil', '8 small shallots', 'a few sprigs of fresh thyme', '4 violet artichokes', '3 rashers of higher-welfare bacon', 'sherry vinegar', '200 ml organic chicken stock', '1 handful of frozen peas', '4 x 125 - 150 g hake fillets, skin on', 'extra virgin olive oil', '1 lemon']",https://www.jamieoliver.com/recipes/fish-recipes/hake-with-braised-artichokes-peas-amp-bacon/
Epic egg salad,lemon chive egg lettuce chicory chicory cress salad cream garlic rapeseed buttermilk,"['4 quality anchovies in oil', '½ a lemon', '½ a bunch of fresh flat-leaf parsley', '½ a bunch of fresh chives', '1 dried red chilli', '4 large free-range eggs', '2 round lettuces', '1 red chicory', '1 white chicory', '1 x 20 g punnet cress', 'SALAD CREAM', '½ a clove of garlic', '2 teaspoons Dijon mustard', '2 tablespoons cider vinegar', '6 tablespoons rapeseed oil', '3 tablespoons buttermilk']",https://www.jamieoliver.com/recipes/eggs-recipes/epic-egg-salad/
Fennel-roasted salmon with soft-boiled eggs,side salmon salmon scaled lemon creme fraiche horseradish use you find quail egg hen egg,"['1 tablespoon fennel seeds', '1 x 1 kg side of salmon or 2 x 500g wild salmon fillets, scaled and pin-boned, from sustainable sources', '1 lemon', '6 tablespoons crème fraîche', '3 tablespoons freshly grated horseradish (or use from a jar if you can’t find fresh)', 'extra virgin olive oil', '16 free-range quail eggs or 8 free-range hen eggs', '2 good handfuls of watercress', '½ a bunch of fresh dill']",https://www.jamieoliver.com/recipes/fish-recipes/fennel-roasted-salmon-with-soft-boiled-eggs/
Black pudding crumpets,pudding eating apple lemon maple syrup crumpet,"['100 g quality black pudding', '1 eating apple', '1 lemon', 'olive oil', '3 tablespoons maple syrup', '4 crumpets', 'extra virgin olive oil', '30 g watercress']",https://www.jamieoliver.com/recipes/pork-recipes/black-pudding-crumpets/
Haggis scotch eggs,egg haggis pork sausage meat pork sausage flour milk panko vegetable deep,"['6 medium free-range eggs', '160 g quality haggis', 'a few sprigs of fresh flat-leaf parsley', '200 g higher-welfare pork sausage meat or 2 thick higher-welfare pork sausages', '40 g plain flour', '1 splash of milk', '120 g panko breadcrumbs', '500 ml vegetable oil , for deep-frying']",https://www.jamieoliver.com/recipes/pork-recipes/haggis-scotch-eggs/
Venison steak-frites,garlic an orange lemon venison haunch steak cranberry redcurrant jelly shoestring fry potato vegetable deep,"['1 clove of garlic', '1 dried red chilli', '2 sprigs of fresh rosemary', '½ an orange or 1 lemon', 'olive oil', '2 venison haunch steaks', 'English mustard', 'cranberry sauce or redcurrant jelly', 'SHOESTRING FRIES', '500 g baking potatoes', '1 litre vegetable oil , for deep-frying']",https://www.jamieoliver.com/recipes/game-recipes/venison-steak-frites/
Picnic pie,garlic onion aubergine courgette butternut squash golden caster sugar spinach ricotta cheese lemon parmesan cheese butter greasing flour shortcrust pastry cheese egg,"['3 cloves of garlic', '3 sprigs of fresh rosemary', '2 large red onions', '2 aubergines', '2 courgettes', '1 medium butternut squash', 'olive oil', '3 large red peppers', '1 tablespoon balsamic vinegar', '½ teaspoon golden caster sugar', '600 g baby spinach', '200 g ricotta cheese', '2 lemons', '60 g Parmesan cheese', 'unsalted butter , for greasing', 'plain flour , for dusting', '640 g shortcrust pastry', '1 bunch of fresh basil', '100 g soft goat’s cheese', '1 large free-range egg']",https://www.jamieoliver.com/recipes/vegetables-recipes/picnic-pie/
One-tray bake,garlic ciabatta chicken thigh drumstick tomato pancetta bacon,"['1 bunch of fresh basil', '1 bulb of garlic', '1 handful of black olives', '1 small ciabatta loaf', '8 free-range chicken thighs or drumsticks', '2 handfuls of cherry tomatoes', 'olive oil', '1 dried red chilli', '8 slices of higher-welfare pancetta or thin-sliced smoked streaky bacon']",https://www.jamieoliver.com/recipes/chicken-recipes/one-tray-bake/
Chickpea flour pancakes with salad & chutney,onion pomegranate flour sunflower greasing tomato raisin chutney golden raisin tomato sunflower panch phoran tomato puree palm sugar wine masala avocado salad avocado grapefruit onion aged,"['½ a medium onion', '½ a fresh green chilli', 'a few sprigs of fresh coriander', '½ teaspoon cumin seeds', '1 teaspoon dried pomegranate seeds , (see note)', '300 g gram (chickpea) flour', '½ teaspoon ground coriander', '¼ teaspoon ground turmeric', 'red chilli powder , to taste', 'sunflower oil , for greasing', 'TOMATO & RAISIN CHUTNEY', '50 g golden raisins', '300 g ripe tomatoes', '2 cm piece of ginger', 'a few sprigs of fresh coriander', '1 tablespoon sunflower oil', '1 tablespoon panch phoran , (see note)', '1 small dried red chilli', '1 tablespoon tomato purée', '100 g palm sugar', '60 ml white wine vinegar', '½ teaspoon ground coriander', '¼ teaspoon garam masala', 'AVOCADO & ROCKET SALAD', '2 ripe avocados', '1 large grapefruit', '½ medium red onion', '1 small bunch of baby rocket', '2 tablespoon olive oil', '1 tablespoon aged balsamic vinegar']",https://www.jamieoliver.com/recipes/vegetables-recipes/chickpea-flour-pancakes-with-salad-chutney/
Sprouting super salad,unpeeled hazelnut chantenay carrot maple syrup avocado sprouting orange orange avocado maple syrup,"['70 g whole unpeeled hazelnuts', '200 g chantenay carrots', '2 tablespoons maple syrup or runny honey', '1 tablespoon avocado oil', '200 g sprouting seed mix', '6 sprigs of fresh flat-leaf parsley', 'ORANGE & HONEY DRESSING', '1 small orange', '1 tablespoon avocado oil', '2 teaspoons maple syrup or runny honey']",https://www.jamieoliver.com/recipes/vegetables-recipes/sprouting-super-salad/
Bulgur & lentil salad,bulgur wheat lentil garlic onion tomato onion pomegranate molasses lemon sumac,"['150 g dark bulgur wheat', '150 g green or yellow lentils', '2 cloves of garlic', '2 fresh bay leaves', '6 spring onions', '2 ripe tomatoes', '2 red peppers', '1 red onion', '½ a bunch of fresh flat-leaf parsley', '½ a bunch of fresh mint', '½ a bunch of fresh dill', '150 ml extra virgin olive oil', '4 tablespoons pomegranate molasses', '2 lemons', '1 teaspoon sumac']",https://www.jamieoliver.com/recipes/vegetables-recipes/bulgur-amp-lentil-salad/
Chicken & green mango Thai salad,peanut chicken breast carrot cucumber mango onion onion plum tomato beansprouts deep fried beancurd fish rice wine lime palm sugar garlic eye,"['1 handful of unsalted peanuts', '2 x 300 g free-range chicken breasts', '1-2 carrots', '1 cucumber', '1 green mango', '1 bunch of fresh mint', '1 small red onion', '2 spring onions', '1 handful of ripe plum or cherry tomatoes', 'optional:', '1 handful of beansprouts', 'optional:', '1 handful of deep-fried beancurd', 'optional:', 'a few sprigs of fresh coriander', 'optional:', '1 fresh red chilli', 'DRESSING', '2 tablespoons fish sauce', '3 tablespoons rice wine vinegar', '1 lime', '2 tablespoons palm sugar', '1 clove of garlic', '1-2 fresh red or green Bird’s Eye chillies']",https://www.jamieoliver.com/recipes/chicken-recipes/chicken-green-mango-thai-salad/
Partridge kyiv,garlic butter partridge breast flour egg stale lemon,"['1 clove of garlic', '75 g unsalted butter , (at room temperature)', '½ a bunch of fresh flat-leaf parsley', '4 x 60 g skinless partridge breasts', '50 g plain flour', '2 large free-range eggs', '2 handfuls of stale breadcrumbs', 'olive oil', '1 lemon']",https://www.jamieoliver.com/recipes/game-recipes/partridge-kyiv/
Grilled veal with Welsh rarebit,veal rump steak welsh rarebit butter flour stout mature cheddar cheese truffle bread,"['3x 220 g higher-welfare veal rump steaks', '2 tablespoons olive oil', '½ a bunch of fresh thyme', 'WELSH RAREBIT', '25 g butter', '25 g plain flour', '1¼ teaspoon mustard powder', '200 ml stout', '200 g mature Cheddar cheese', '½-1 teaspoon truffle oil', '6 slices of bread', 'Worcestershire sauce']",https://www.jamieoliver.com/recipes/beef-recipes/grilled-veal-with-welsh-rarebit/
Game salad recipe | Jamie Oliver recipes,ready bake ciabatta bean horseradish wine creme fraiche lemon pheasant partridge,"['2 bunches of watercress', 'a few sprigs of fresh thyme', '½ a ready-to-bake ciabatta', '1 tablespoon groundnut oil', '1 whole nutmeg , for grating', '200 g green beans', '2 tablespoons freshly grated horseradish', '2-3 tablespoons red wine vinegar', '3 tablespoons crème fraîche', 'extra virgin olive oil', '1 lemon', '300-400 g leftover roast pheasant and partridge']",https://www.jamieoliver.com/recipes/game-recipes/game-bird-salad-with-horseradish-dressing/
Arrosto misto,garlic chicken lemon duck onion sturdy pigeon partridge quail sausage one string flour chianti other wine plum tomato chicken stock gremolata garlic lemon polenta coarse polenta butter parmesan cheese,"['1 bulb of garlic', '½ a bunch of fresh thyme , (15g)', 'olive oil', '1 x 1.8 kg whole free-range chicken', '1 lemon', '1 x 2 kg duck', '1 stick of cinnamon', '½ a bunch of fresh sage , (15g)', '4 bulbs of fennel', '6 red onions', '8 sturdy sprigs of fresh rosemary', '2 pigeons', '2 partridges', '2 quails', '500 g quality sausages , in one string', '8 fresh bay leaves', '1 tablespoon plain flour', '150 ml Chianti , or other red wine', '1 x 400 g tin of quality plum tomatoes', '300 ml quality organic chicken stock', 'GREMOLATA', '2 cloves of garlic', '½ a bunch of fresh flat-leaf parsley , (15g)', '1 lemon', 'POLENTA', '250 g coarse polenta', '100 g unsalted butter', '150 g Parmesan cheese']",https://www.jamieoliver.com/recipes/game-recipes/arrosto-misto/
David Tennant's Croatian-style cuttlefish risotto,cuttlefish trimming reserved total chicken stock onion garlic tomato butter fillet tomato puree wine cuttlefish ink risotto rice lemon,"['1 x 1.2 kg cuttlefish , cleaned, skin and trimmings reserved (500g total meat), from sustainable sources', '1 litre quality organic chicken stock , (optional)', '1 red onion', '1 clove of garlic', '½ a bunch of fresh flat-leaf parsley , (15g)', '3 large ripe tomatoes', 'olive oil', '30 g unsalted butter', '3 anchovy fillets in oil , from sustainable sources', '1 tablespoon tomato purée', '50 ml white wine', '1 teaspoon cuttlefish ink , from sustainable sources', '300 g risotto rice', '1 fresh red chilli', '1 lemon', 'extra virgin olive oil']",https://www.jamieoliver.com/recipes/rice-recipes/david-tennant-s-croatian-style-cuttlefish-risotto/
Warm mackerel & potato salad,jersey royal potato onion chorizo lemon mackerel,"['600 g Jersey royal potatoes', '1 bunch of spring onions', '1 bunch of fresh flat-leaf parsley', '200 g quality chorizo', '2 lemons', 'extra virgin olive oil', '4 mackerel fillets, from sustainable sources']",https://www.jamieoliver.com/recipes/fish-recipes/warm-mackerel-potato-salad/
Post-gym super salad,quinoa cucumber iceberg lettuce carrot an eating apple tomato spinach lime yoghurt chicken breast cress,"['60 g regular, black or red quinoa', '¼ of a small cucumber', '¼ of a small iceberg lettuce', '½ a small carrot', '½ an eating apple', '1 ripe tomato', '½-1 fresh red chilli', '2 sprigs of fresh mint', '1 small handful of baby spinach', '1 lime', '1 heaped tablespoon natural yoghurt', '1 teaspoon hot chilli sauce', '80 g leftover cooked skinless chicken breast', '½ a punnet of cress']",https://www.jamieoliver.com/recipes/vegetables-recipes/post-gym-super-salad/
Caldo verde,onion garlic potato kale cavolo nero chorizo,"['1 large onion', '2 cloves of garlic', '700 g potatoes', '300 g kale or cavolo nero', 'extra virgin olive oil', '150 g higher-welfare chorizo', 'paprika']",https://www.jamieoliver.com/recipes/pork-recipes/caldo-verde/
Classic minestrone,bacon onion garlic carrot celery wine courgette savoy cabbage chard plum tomato cannellini bean chicken vegetable stock pasta odd parmesan cheese,"['4 rashers of higher-welfare smoked streaky bacon', '2 red onions', '2 cloves of garlic', '2 carrots', '2 sticks of celery', '1 bulb of fennel', '½ a bunch of fresh basil', 'olive oil', '125 ml red wine', '2 courgettes', '300 g savoy cabbage or chard', '2 x 400 g tins of quality plum tomatoes', '1 x 400 g tin of cannellini beans', '800 ml organic chicken or vegetable stock', '75 g dried pasta (shells or odd ends)', 'extra virgin olive oil', 'Parmesan cheese']",https://www.jamieoliver.com/recipes/vegetables-recipes/classic-minestrone/
Fearne Cotton's Mexican fish tacos,garlic cabbage jalapeno wine soured cream yoghurt lime flour tortilla cannellini bean haddock fillet lemon pineapple salsa pineapple onion lime guacamole onion onion tomato avocado lime,"['1 bulb of garlic', '½ a red cabbage , (400g)', '1 fresh green jalapeño chilli', '1 tablespoon red wine vinegar', '150 g soured cream or natural yoghurt', '1 lime', '4 sprigs of fresh flat-leaf parsley', '4–8 flour tortillas', '1 x 400 g tin of cannellini beans', 'olive oil', '4 x 200 g haddock fillets , skin on, scaled, pin-boned, from sustainable sources', '1 lemon', 'PINEAPPLE SALSA', '1 small fresh pineapple', '1 small red onion', '½ a bunch of fresh mint , (15g)', '2 fresh mixed-colour chillies', '2 limes', 'extra virgin olive oil', 'GUACAMOLE', '½ a small red onion', '2 spring onions', '1–2 fresh red chillies', '2 ripe tomatoes', '3 ripe avocados', '½ a bunch of fresh mint , (15g)', '1 lime']",https://www.jamieoliver.com/recipes/fish-recipes/mexican-fish-tacos/
Baked potato soup,potato baked potato butter onion parmesan rind whatever you have chicken vegetable stock cream chive,"['3 large baking potatoes or leftover baked potatoes', '40 g butter', '1 onion', '1 Parmesan rind , whatever size you have in the fridge, optional', '1.5 litres organic chicken or vegetable stock', 'sour cream', '1 small bunch of fresh chives']",https://www.jamieoliver.com/recipes/vegetables-recipes/baked-potato-soup/
"Parsnip, sage & white bean soup",soup onion parsnip cannellini bean chicken stock crispy parsnip parsnip,"['SOUP', '1 onion', '2 large parsnips', '1 x 420 g tin of cannellini beans', '1 sprig of fresh sage', 'olive oil', '1 fresh bay leaf', '1 organic litre chicken stock', 'CRISPY PARSNIPS', '1 parsnip', '2 sprigs of fresh sage']",https://www.jamieoliver.com/recipes/vegetables-recipes/parsnip-sage-white-bean-soup/
Healthy chicken Caesar,lemon parmesan cheese fillet yoghurt wine onion cauliflower romaine lettuce chicken breast wholemeal bread,"['1 lemon', '15 g Parmesan cheese', '2 anchovy fillets in oil', '4 heaped tablespoons natural yoghurt', '½ teaspoon English mustard', '1 teaspoon Worcestershire sauce', 'white wine vinegar', 'extra virgin olive oil', '1 small red onion', '½ a small cauliflower (300g)', '1 romaine lettuce', 'olive oil', '1 sprig of fresh rosemary', '2 x 120 g free-range skinless chicken breasts', '1 thick slice of wholemeal bread']",https://www.jamieoliver.com/recipes/chicken-recipes/healthy-chicken-caesar/
Moroccan-style roast chicken,preserved lemon ra el hanout chicken rose petal,"['2 preserved lemons', '1 tablespoon ras el hanout', '1 dried chilli', '1 x 1.6kg whole free-range chicken', 'olive oil', '1 teaspoon rose petals (unsprayed) , optional', 'a few sprigs of fresh coriander']",https://www.jamieoliver.com/recipes/chicken-recipes/moroccan-style-roast-chicken/
Five-spice salmon tacos,salmon five yoghurt cucumber shallot wine sugar flour tortilla,"['4 x 125 g salmon fillets, skin on, from sustainable sources', '2-3 teaspoons five spice powder', 'olive oil', '½ a bunch of fresh coriander', '½ a bunch of fresh mint', '150 g plain fat-free yoghurt', '1 cucumber', '2 shallots', '1 fresh red chilli', '1 tablespoon white wine vinegar', '1 pinch of sugar', '4 corn or flour tortillas']",https://www.jamieoliver.com/recipes/fish-recipes/five-spice-salmon-tacos/
Baked sole goujons,lemon sole fillet flour egg,"['olive oil', '450 g lemon sole fillets , skinned, from sustainable sources', '50 g plain flour', '2 large free-range eggs', '1 tablespoons sweet smoked paprika', '2 large handfuls breadcrumbs']",https://www.jamieoliver.com/recipes/fish-recipes/baked-sole-goujons/
Stilton & pear gnocchi,garlic pear butter creme fraiche stilton gnocchi,"['1 clove of garlic', '1 large pear', 'a few sprigs of fresh flat-leaf parsley', '1 knob of unsalted butter', '2 tablespoons crème fraîche', '50 g stilton', '400 g gnocchi']",https://www.jamieoliver.com/recipes/vegetables-recipes/stilton-pear-gnocchi/
Stilton & sprouting broccoli frittata,purple sprouting broccoli egg stilton other blue cheese parmesan cheese butter salad lemon,"['200 g purple sprouting broccoli', 'extra virgin olive oil', '½ a bunch of fresh flat-leaf parsley', '6 large free-range eggs', '50 g Stilton or other blue cheese', 'Parmesan cheese', '1 knob of unsalted butter', 'SALAD', '25 g pine nuts', '1 lemon']",https://www.jamieoliver.com/recipes/eggs-recipes/stilton-amp-sprouting-broccoli-frittata/
Healthy greens box,broccoli spinach couscous lemon harissa feta cheese,"['½ a small head of broccoli', '1 handful of baby spinach', '½ a small bunch of fresh mint', '80 g couscous', '1 lemon', '1 handful of mixed seeds', '1 good pinch of ground cumin', 'olive oil', '1 heaped teaspoon harissa', '50 g feta cheese']",https://www.jamieoliver.com/recipes/vegetables-recipes/healthy-greens-box/
Turkey kofte,turkey kofte courgette onion pistachio egg minced turkey tomato onion garlic sugar tomato puree wine tahini yoghurt greek yoghurt tahini squeeze lemon turkish pilav onion garlic bulgur wheat chicken stock butter rice vermicelli chickpea,"['TURKEY KOFTE', '1 large courgette', '2 spring onions', '1 fresh red chilli', '50 g shelled pistachios', '3 sprigs of fresh coriander', '3 sprigs of fresh flat-leaf parsley', '3 sprigs of fresh mint', '¼ teaspoon cumin seeds', '1 large free-range egg', '500 g free-range minced turkey', '½ teaspoon dried oregano', 'CHILLI SAUCE', '4 ripe tomatoes', '2 small onions', '4 cloves of garlic', '4 fresh red chillies', 'olive oil', '1 tablespoon brown sugar', '2 tablespoons tomato purée', '1 tablespoon red wine vinegar', 'TAHINI YOGHURT', '250 g Greek yoghurt', '1 tablespoon tahini', '1 squeeze of lemon juice', 'TURKISH PILAV', '1 onion', '2 cloves of garlic', '200 g bulgur wheat', '400 ml hot organic chicken stock', '1 knob of unsalted butter', '80 g broken rice vermicelli', '100 g tinned chickpeas (drained weight)']",https://www.jamieoliver.com/recipes/turkey-recipes/turkey-kofte/
The Hix turkey burger,minced turkey thigh butcher do cumberland sausage meat brussels sprout mayonnaise vegetable hamburger bun cranberry cranberry orange sugar,"['450 g coarsely minced free-range turkey thighs (ask your butcher to do this)', '100 g Cumberland sausage meat', '5-10 Brussels sprouts', '2-3 tablespoons free-range mayonnaise', 'vegetable oil', '4 hamburger buns', 'CRANBERRY SAUCE', '500 g fresh or frozen cranberries', '400 ml fresh orange juice', '250 g sugar', '½ teaspoon ground cinnamon', '½ teaspoon ground cloves', '1 fresh bay leaf']",https://www.jamieoliver.com/recipes/turkey-recipes/the-hix-turkey-burger/
