recipe_name,ingredients_parsed,ingredients,recipe_urls
Sausages with pan cooked chutney and leek mash,potato leek milk onion cranberry pork sausage,"['1 kg potatoes , peeled and halved', 'olive oil', '2 leeks , sliced and washed', '200 ml milk', 'extra virgin olive oil , leaves picked', '1 sprig fresh sage , leaves picked', '2 red onions , cut into thin wedges', '1 good handful fresh or frozen (and thawed) cranberries', '2.5 cm piece cinnamon stick', '5 cm piece fresh ginger , grated', '3 tablespoons balsamic vinegar', '8 higher-welfare pork sausages']",https://www.jamieoliver.com/recipes/pork-recipes/sausages-with-pan-cooked-chutney-and-leek-mash/
"Roast trout with spinach, sage and prosciutto",trout fillet scaled pinboned apricot chopped garlic spinach cannellini bean chickpea prosciutto,"['8 x 120 g trout fillets , from sustainable sources, ask your fishmonger, skin on, scaled and pinboned', '75 g ground almonds', '2 handfuls dried apricots , chopped', '2 large sprigs fresh sage , leaves picked', 'olive oil', '1 clove garlic , crushed', '600 g spinach', 'fresh nutmeg , grated', '410 g tinned cannellini beans , drained', '410 g tinned chickpeas , drained', '4 large slices quality prosciutto']",https://www.jamieoliver.com/recipes/fish-recipes/roast-trout-with-spinach-sage-and-prosciutto/
Quick stewed squid with tomatoes,onion garlic chopped chopped tomato butter bean squid ring lemon lemon,"['1 splash olive oil', '1 small red onion , finely diced', '1 clove garlic , sliced', 'a few sprigs fresh parsley , leaves picked and chopped, stalks chopped', '1 small handful pitted black olives', '1 red chilli , deseeded and finely sliced', '1 pinch smoked paprika', '400 g tinned chopped tomatoes', '215 g tinned butter beans , drained and rinsed', '300 g fresh squid , from sustainable sources, ask your fishmonger, cleaned, cut into pieces and scored, or sliced into rings', 'lemon zest , finely grated', 'lemon wedges , to serve']",https://www.jamieoliver.com/recipes/seafood-recipes/quick-stewed-squid-with-tomatoes/
"Pork chops with prosciutto, apple and Stilton",prosciutto pork chop apple cored stilton cheese skewer,"['12 slices quality prosciutto', '4 higher-welfare pork chops , French trimmed and all fat removed', '1 small red apple , cored and sliced', '75 g Stilton cheese , crumbled', '4 large rosemary sprigs , to skewer']",https://www.jamieoliver.com/recipes/pork-recipes/pork-chops-with-prosciutto-apple-and-stilton/
Pancetta hash with eggs and apple salad,pancetta wide ham potato wine very egg apple very squeeze lemon,"['olive oil', '6 slices higher-welfare pancetta , cut into wide strips', '2 slices good-quality ham , torn into pieces', '500 g potatoes , cubed', '1 splash white wine vinegar', '2 very fresh free-range eggs', '1 large handful watercress', '1 red apple , very finely sliced', '1 squeeze lemon juice']",https://www.jamieoliver.com/recipes/pork-recipes/pancetta-hash-with-eggs-and-apple-salad/
Marinated & grilled salmon,lemongrass garlic soy salmon fillet scaled onion lime,"['2 sticks of fresh lemongrass', '1 bunch of fresh coriander , (30g)', '5cm piece of fresh ginger', '4 cloves of garlic', '½ x small bottle of low-salt dark soy sauce', '1 large salmon fillet , (about 1kg), ask your fishmonger, scaled and pin-boned, from sustainable sources', '4 tablespoons runny honey', '2 red chillies', '4 spring onions', '2 limes']",https://www.jamieoliver.com/recipes/fish-recipes/marinated-and-grilled-salmon/
"Yellow bean, vodka and smoked haddock risotto",basic risotto recipe shot vodka place wine basic risotto recipe haddock undyed milk bean celery heart,"['1 basic risotto recipe', '4 shots vodka , in place of wine in the basic risotto recipe', '700 g smoked haddock , from sustainable sources, ask your fishmonger, undyed', '565 ml milk', '2 bay leaves', '255 g yellow beans , stalks removed, finely sliced', '1 handful yellow celery leaves, from the heart']",https://www.jamieoliver.com/recipes/rice-recipes/yellow-bean-vodka-and-smoked-haddock-risotto/
Wood-fired shellfish,prawn scallop garlic lemon tarragon,"['2 kg mixed seafood, such as clams, mussels, prawns and scallops , from sustainable sources, ask your fishmonger', '2 cloves garlic , peeled', 'sea salt', 'freshly ground black pepper', '2 lemons', 'extra virgin olive oil', 'a few sprigs of soft fresh herbs, such as parsley, mint and tarragon , leaves picked and chopped, to serve']",https://www.jamieoliver.com/recipes/seafood-recipes/wood-fired-shellfish/
Wicked chicken with coleslaw,chicken thigh lemon garlic roll coleslaw carrot cabbage outer onion very yoghurt grainy,"['4 higher-welfare chicken thighs', '1 lemon', '1 red chilli , halved, deseeded and thinly sliced', '2 cloves garlic , crushed', 'sea salt', 'freshly ground black pepper', '4 fresh rolls , halved', 'For the coleslaw', '2 carrots', '1 small white cabbage , outer leaves torn off, cut into 4 wedges', '1 small onion , peeled and very finely sliced', '2 tablespoons fat-free natural yoghurt', '1 tablespoon grainy mustard', 'sea salt', 'freshly ground black pepper', '1 handful rocket']",https://www.jamieoliver.com/recipes/chicken-recipes/wicked-chicken-with-coleslaw/
"Warm salad of roasted squash, prosciutto and pecorino",butternut squash prosciutto parma ham block parmesan cheese,"['1 butternut squash', 'olive oil', 'sea salt', 'freshly ground black pepper', '1 small dried red chilli', '1 heaped teaspoon coriander seeds', '20 slices quality prosciutto or Parma ham', '4 handfuls rocket', '6 tablespoons extra virgin olive oil', '4 tablespoons balsamic vinegar', '1 small block pecorino or Parmesan cheese']",https://www.jamieoliver.com/recipes/vegetables-recipes/warm-salad-of-roasted-squash-prosciutto-and-pecorino/
Venison & juniper stew,flour stewing venison beef onion chopped carrot chopped celery chopped juniper berry pestle mortar chopped butter beef stock potato scrubbed larger one garlic chopped,"['4 tablespoons plain flour', '800 g quality stewing venison or beef , cut into 2cm chunks', 'olive oil', '2 onions , peeled and roughly chopped', '3 carrots , peeled and roughly chopped', '2 sticks celery , trimmed and roughly chopped', '1 tablespoon juniper berries , crushed in a pestle and mortar', '2 sprigs of rosemary , leaves picked and chopped', '1 knob butter', '6 sprigs of fresh flat-leaf parsley', '2 organic beef stock cubes', '600 g small new potatoes , scrubbed clean, larger ones halved', '1 clove garlic , peeled and finely chopped']",https://www.jamieoliver.com/recipes/game-recipes/venison-juniper-stew/
Versatile veggie chilli,potato sprinkling sprinkling sprinkling onion garlic cannellini plum tomato lime lemon,"['500 g sweet potatoes', '1 level teaspoon cayenne pepper , plus extra for sprinkling', '1 heaped teaspoon ground cumin , plus extra for sprinkling', '1 level teaspoon ground cinnamon , plus extra for sprinkling', 'olive oil', '1 onion', '2 mixed-colour peppers', '2 cloves of garlic', '1 bunch of fresh coriander (30g)', '2 fresh mixed-colour chillies', '2 x 400 g tins of beans, such as kidney, chickpea, pinto, cannellini', '2 x 400 g tins of plum tomatoes', 'lime or lemon juice, or vinegar , to taste']",https://www.jamieoliver.com/recipes/vegetables-recipes/veggie-chilli/
Vegetable curry,vegetable onion chopped courgette butternut squash mushroom cauliflower curry base,"['vegetable oil', '1 medium red onion , peeled and chopped', '1 courgette , diced', '½ butternut squash , peeled and diced', '100 g mushrooms , quartered', '1 red pepper , diced', '150 g cauliflower , broken into florets', '600 ml curry base sauce', '400 ml water']",https://www.jamieoliver.com/recipes/vegetables-recipes/vegetable-curry/
Turkey con chilli,onion carrot leek wine turkey plum tomato butter bean chickpea lime soured cream guacamole avocado tomato onion garlic lime,"['2 red onions', '1 carrot', '1 leek', '1 red pepper', '1 yellow pepper', '1 fresh red chilli', '1 fresh green chilli', 'olive oil', '1 bunch of fresh coriander , (30g)', '1 teaspoon ground cumin', '1 heaped teaspoon smoked paprika', '1 heaped teaspoon runny honey , optional', '3 tablespoons white wine vinegar , optional', '600 g leftover turkey', '3 x 400 g tins of quality plum tomatoes', '1 x 400 g tin of butter beans or chickpeas', '2 limes', 'soured cream , to serve', 'Guacamole', '2 ripe avocados', '2 ripe tomatoes', '¼ of a red onion', '½ a clove of garlic', '1 fresh green chilli', '1 bunch of fresh coriander , (30g)', '1 lime']",https://www.jamieoliver.com/recipes/turkey-recipes/turkey-con-chilli/
Turkey and sweet leek pie,bacon chopped leek end chopped end turkey meat flour chicken vegetable stock creme fraiche puff pastry jarred vac chesntnuts egg,"['2 rashers higher-welfare smoked streaky bacon , roughly chopped', '½ bunch fresh thyme , leaves picked', 'olive oil', '2 kg leeks , washed, trimmed; white end chopped into chunks, green end finely sliced', 'sea salt', 'freshly ground black pepper', '800 g cooked white turkey meat , torn into big chunks', '2 heaped tablespoons plain flour , plus extra for dusting', '2 pints organic turkey, chicken or vegetable stock', '2 tablespoons crème fraîche', '500 g puff pastry', '12 jarred or vac-packed chesntnuts , roasted and peeled', '2 sprigs of fresh sage , leaves picked', '1 free-range egg , beaten']",https://www.jamieoliver.com/recipes/turkey-recipes/turkey-and-sweet-leek-pie/
Tunisian brik,potato onion chopped egg butter sheet filo pastry onion yoghurt lemon,"['2 medium sweet potatoes', '1½ teaspoons coriander seeds', '2 dried red chillies', '½ teaspoon ground cinnamon , plus a little extra', 'sea salt', 'freshly ground black pepper', '2 spring onions , trimmed and finely chopped', '1 large free-range egg , beaten', '150 g butter', '6 sheets filo pastry', '1 red onion , finely sliced', '1 bunch fresh watercress', '1 bunch fresh mint , leaves picked', '1 bunch fresh flat-leaf parsley , leaves picked', '4 tablespoons fat-free natural yoghurt', '3 lemons , 1 juiced, 2 cut in half', 'extra virgin olive oil', '1 pinch ground cumin']",https://www.jamieoliver.com/recipes/vegetables-recipes/tunisian-brik/
Toad in the hole,sunflower sausage onion garlic butter vegetable stock vegetable stock batter milk flour egg,"['sunflower oil', '8 higher-welfare sausages', '4 sprigs of fresh rosemary', '2 large red onions', '2 cloves of garlic', '2 knobs of unsalted butter', '6 tablespoons balsamic vinegar', '1 level tablespoon vegetable stock powder or 1 organic vegetable stock cube', 'BATTER', '285 ml milk', '115 g plain flour', '3 large free-range eggs']",https://www.jamieoliver.com/recipes/pork-recipes/toad-in-the-hole/
Three cheese risotto,chicken vegetable stock onion chopped garlic chopped celery chopped risotto rice glass wine appenzeller gruyere cheese chopped taleggio cheese chopped butter parmesan cheese,"['1 litre organic chicken or vegetable stock , hot', '1 tablespoon olive oil', '2 medium onions , peeled and finely chopped', '2 cloves garlic , peeled and finely chopped', '3 sticks celery , trimmed and finely chopped', '400 g risotto rice', '2 glasses dry white wine', 'sea salt', 'freshly ground black pepper', '75 g Appenzeller or Gruyere cheese , roughly chopped', '75 g Taleggio cheese , roughly chopped', '1 knob butter', '40 g Parmesan cheese , freshly grated']",https://www.jamieoliver.com/recipes/rice-recipes/three-cheese-risotto/
The real mushroom soup,porcini mushroom trompettes de clean garlic onion chopped chicken vegetable stock chopped mascarpone cheese lemon truffle,"['1 small handful dried porcini', 'olive oil', '600 g mixed fresh wild mushrooms (chanterelles, girolles, trompettes de mort, shiitake, oyster) , clean and sliced', '2 cloves garlic , peeled and finely sliced', '1 red onion , peeled and finely chopped', '1 handful fresh thyme , leaves picked', 'sea salt', 'freshly ground black pepper', '1 litre organic chicken or vegetable stock', '1 handful fresh flat-leaf parsley , leaves picked and roughly chopped', '1 tablespoon mascarpone cheese', '1 lemon', 'truffle oil , optional']",https://www.jamieoliver.com/recipes/vegetables-recipes/the-real-mushroom-soup/
The nicest tray-baked lemon sole,onion lemon destoned chopped chopped lemon sol tomato garlic,"['1 bunch spring onions , trimmed and finely sliced', '1 tablespoon balsamic vinegar', 'sea salt', 'freshly ground black pepper', '2 lemons , zest of, halved', 'extra virgin olive oil', '1 handful black olives , destoned and chopped', '1 handful fresh flat-leaf parsley , finely chopped', '4 whole lemon soles , from sustainable sources, ask your fishmonger', '2 handfuls red and yellow cherry tomatoes , halved', '4 cloves garlic , peeled and finely sliced', '1 handful fresh oregano or basil , leaves picked']",https://www.jamieoliver.com/recipes/fish-recipes/the-nicest-tray-baked-lemon-sole/
The best turkey in the world,turkey flavoured butter clementine carrot onion celery,"['6.5-8 kg higher-welfare turkey', 'flavoured butter', '2-4 clementines', 'a few sprigs of fresh herbs', '1 sprig of fresh rosemary', '', '2-3 carrots', '3 onions , peeled', '2 sticks celery']",https://www.jamieoliver.com/recipes/turkey-recipes/the-best-turkey-in-the-world/
The best tuna meatballs (Le migliori polpette di tonno),tomato onion chopped garlic plum tomato wine chopped meatball tuna chopped stale parmesan egg lemon,"['for the tomato sauce', 'olive oil', '1 small onion , peeled and finely chopped', '4 cloves garlic , peeled and finely sliced', '1 teaspoon dried oregano', '2 x 400 g good-quality tinned plum tomatoes', 'sea salt', 'freshly ground black pepper', 'red wine vinegar', '1 small bunch fresh flat-leaf parsley , leaves picked and roughly chopped', 'for the meatballs', '400 g tuna , from sustainable sources, ask your fishmonger', 'olive oil', '55 g pine nuts', '1 level teaspoon ground cinnamon', 'sea salt', 'freshly ground black pepper', '1 teaspoon dried oregano', '1 handful fresh flat-leaf parsley , chopped', '100 g stale breadcrumbs', '25 g Parmesan , freshly grated', '2 free-range eggs', '1 lemon']",https://www.jamieoliver.com/recipes/fish-recipes/the-best-tuna-meatballs-le-migliori-polpette-di-tonno/
The best tuna burger,onion lemon tuna steak lettuce tomato ciabatta roll burger bun tomato salsa verde,"['1 sprig of fresh basil', '1 sprig of fresh mint', '4 spring onions', '1 fresh red chilli', '1 lemon', '600 g fresh tuna steak , from sustainable sources', '1 pinch of ground coriander', 'olive oil', '½ a round lettuce', '1 handful of rocket leaves', '2 ripe tomatoes', '4 ciabatta rolls or burger buns', 'tomato ketchup or salsa verde']",https://www.jamieoliver.com/recipes/fish-recipes/the-best-tuna-burger/
The best roast turkey - Christmas or any time,pancetta bacon garlic onion celery apricot minced pork lemon egg turkey at carrot orange flour chicken vegetable stock,"['1 sprig of fresh sage', '12 strips higher-welfare pancetta or thinly sliced streaky bacon', '1 bulb garlic', '4 medium red onions', '2 sticks celery', '1 big handful of breadcrumbs', '1 handful of dried apricots', '300 g higher-welfare minced pork', '1 lemon', '1 pinch of grated nutmeg', '1 large free-range egg', '12 small sprigs of fresh rosemary , plus a few extra', '4-4.5 kg higher-welfare turkey , at room temperature', '2 carrots', '1 large orange', 'olive oil', '2 tablespoons plain flour', '1.1 litres organic chicken or vegetable stock']",https://www.jamieoliver.com/recipes/turkey-recipes/the-best-roast-turkey-christmas-or-any-time/
"The best pork chops with fresh bay salt, crackling and squashed purple potatoes",purple desiree potato pork chop but kept wholegrain creme fraiche butter,"['1 kg purple or Desirée potatoes , peeled and halved', 'sea salt', 'freshly ground black pepper', '4 higher-welfare pork chops , skin removed but kept', 'extra virgin olive oil', '1 small handful fresh thyme , leaves picked', '1 teaspoon fennel seeds', '10 bay leaves', '285 ml cider', '1 tablespoon wholegrain mustard', '4 tablespoons low fat crème fraîche', '1 knob butter']",https://www.jamieoliver.com/recipes/pork-recipes/the-best-pork-chops-with-fresh-bay-salt-crackling-and-squashed-purple-potatoes/
The best pasta salad,shaped pasta garlic tomato tomato chive cucumber wine,"['310 g small shell-shaped pasta', '3 cloves garlic', '255 g yellow cherry tomatoes', '255 g red cherry tomatoes', '1 handful black olives , pitted', '2 tablespoons fresh chives', '1 handful fresh basil', '½ cucumber', '4 tablespoons white wine vinegar , or to taste', '7 tablespoons extra virgin olive oil', 'sea salt', 'freshly ground black pepper']",https://www.jamieoliver.com/recipes/pasta-recipes/the-best-pasta-salad/
The best baked pumpkin,pumpkin about garlic onion chopped stoned chopped chopped rice cranberry pistachio tangerine vegetable stock,"['1 pumpkin , about 1kg', '2 cloves garlic , peeled', 'olive oil', '1 red onion , peeled and finely chopped', '1 small handful black olives , stoned and chopped', '2 sprigs of fresh rosemary , leaves finely chopped', '1 dried chilli', 'sea salt', 'freshly ground black pepper', '½ teaspoon ground nutmeg', '½ teaspoon ground cinnamon', '50 g basmati rice , washed and drained', '75 g dried cranberries', '50 g shelled pistachio nuts', '1 tangerine , zest of', '200 ml organic vegetable stock']",https://www.jamieoliver.com/recipes/vegetables-recipes/the-best-baked-pumpkin/
"Tapas feast: tortilla, glazed chorizo, Manchego cheese, cured meats & honey, stuffed peppers, rolled anchovies",tortilla potato onion garlic egg prewashed chorizo semi cured iberico chorizo garlic wine manchego cheese ciabatta blanched wine jarred manchego manchego cheese spanish cured pata negra drizzling instant coffee chilled marinated dressed lemon tomato sparkling orange,"['TORTILLA', '250 g baby new potatoes', '1 small red onion', '1 teaspoon fennel seeds', '2 cloves garlic', '½ small bunch fresh rosemary', '8 free-range eggs', '1 large handful prewashed rocket , to serve', 'CHORIZO', '250 g semi-cured whole iberico chorizo', '2 cloves garlic', '4 tablespoons red wine vinegar', '1 tablespoon runny honey', 'PEPPERS', '50 g Manchego cheese', '1 loaf ciabatta', '50 g blanched almonds', '1 small bunch fresh thyme', 'red wine vinegar', '450 g jarred whole peppers', 'MANCHEGO', '100 g Manchego cheese', '100 g quality Spanish cured meats, such as pata negra', 'runny honey , for drizzling', 'instant or quality ground coffee', '1 handful black olives', '2 sprigs of fresh thyme or oregano , optional', 'ANCHOVIES', '50 g chilled marinated or dressed anchovies', 'a few sprigs of fresh flat-leaf parsley', '1 lemon', '150 g cherry tomatoes', 'smoked paprika , for dusting', 'SEASONINGS', 'olive oil', 'extra virgin olive oil', 'sea salt', 'black pepper', 'TO SERVE', '1 bottle sparkling water , to serve', '1 orange , to serve', '1 bottle dry sherry , chilled, to serve']",https://www.jamieoliver.com/recipes/pork-recipes/tapas-feast-tortilla-glazed-chorizo-manchego-cheese-cured-meats-honey-stuffed-peppers-rolled-anchovies/
Taglierini with a simple sweet tomato sauce and shrimps,plum tomato prawn shrimp garlic chopped lemon shot vecchia romana cognac single cream taglierini chopped,"['8 plum tomatoes', 'sea salt', 'freshly ground black pepper', 'extra virgin olive oil', '300 g small peeled prawns or shrimps , from sustainable sources, ask your fishmonger', '1 clove garlic , peeled and finely chopped', '1 lemon , zest and juice of', '2 shots Vecchia Romana or Cognac', '142 ml single cream', '400 g fresh or dried taglierini', '1 large handful fresh parsley , roughly chopped']",https://www.jamieoliver.com/recipes/pasta-recipes/taglierini-with-a-simple-sweet-tomato-sauce-and-shrimps/
"Tagliatelle with asparagus, crispy pancetta and Parmesan",asparagus pancetta egg tagliatelle parmesan,"['1 bunch asparagus', '12 thin slices higher-welfare pancetta , sliced into small strips', '500 g fresh egg tagliatelle', '40 g Parmesan , grated', 'sea salt', 'freshly ground black pepper', 'extra virgin olive oil']",https://www.jamieoliver.com/recipes/pasta-recipes/tagliatelle-with-asparagus-crispy-pancetta-and-parmesan/
Sweet duck legs cooked with plums and star anise,duck soy five star plum destoned demerara sugar,"['4 fat duck legs', '4 tablespoons soy sauce', '3 teaspoons five-spice', '1 handful star anise', '½ stick cinnamon', '1 tablespoon olive oil', '1-2 fresh red chillies , deseeded and sliced', '16 plums , halved and destoned', '2 tablespoons Demerara sugar']",https://www.jamieoliver.com/recipes/duck-recipes/sweet-duck-legs-cooked-with-plums-and-star-anise/
Sweet cherry tomato and sausage bake,lovely tomato you find them garlic chopped cumberland coarse pork sausage,"['2 kg lovely ripe cherry tomatoes , mixed colours if you can find them', '2 sprigs fresh thyme', '2 sprigs fresh rosemary', '2 sprigs fresh bay', '1 tablespoon dried oregano', '3 cloves garlic , peeled and chopped', '12 higher-welfare Cumberland or coarse Italian pork sausages', 'extra virgin olive oil', 'balsamic vinegar']",https://www.jamieoliver.com/recipes/pork-recipes/sweet-cherry-tomato-and-sausage-bake/
Super tasty Spanish roast chicken,potato dice lemon chicken iberico chorizo sausage garlic chopped,"['1.6 kg potatoes , peeled and cut into 2.5cm dice', '4 lemons', '1 handful fresh flat-leaf parsley', '2 kg higher-welfare chicken', 'sea salt', 'freshly ground black pepper', '300 g iberico chorizo sausage', 'olive oil', '2 cloves garlic , peeled and finely chopped']",https://www.jamieoliver.com/recipes/chicken-recipes/super-tasty-spanish-roast-chicken/
Summertime tagliarini,lemon chopped left parmesan cheese shaving cheese tagliarini tagliatelle,"['75 g pine nuts', '2 lemons , juice and zest of', '1 bunch fresh flat-leaf parsley (30g) , leaves picked, half finely chopped and half left whole', '135 ml extra virgin olive oil', '95 g Parmesan cheese , freshly grated, plus extra for shaving', '30 g pecorino cheese , freshly grated', '320 g good-quality tagliarini or tagliatelle']",https://www.jamieoliver.com/recipes/pasta-recipes/summertime-tagliarini/
Stuffed sea bass,bass tail garlic butter potato lemon wine tomato,"['2 whole sea bass , from sustainable sources, ask your fishmonger, cleaned and gutted, head and tail on', '1 whole fennel', '1 teaspoon fennel seeds', '2 cloves garlic', '50 ml olive oil', '35 g butter', '½ a bunch of fresh dill', '½ a bunch of fresh flat-leaf parsley', '½ a bunch of fresh basil', '½ a bunch of fresh mint', '10 baby potatoes', '20 capers', '1 lemon', '200 ml white wine', '200 g tomato and basil sauce']",https://www.jamieoliver.com/recipes/fish-recipes/stuffed-sea-bass/
Steamed Thai-style sea bass and rice,paste reserved garlic sesame soy lime coconut milk bass rice rice bass fillet pinboned scored sugar snap pea mangetouts onion outer lime,"['For the Thai paste', '2 large bunches fresh coriander , leaves picked and stalks reserved', '2 thumb-sized pieces fresh ginger , peeled', '3 cloves garlic , peeled', '2 fresh red chillies , halved and deseeded', '2 teaspoons sesame oil', '6 tablespoons soy sauce', '2 limes , juice and zest of', '400 ml light coconut milk', 'For the sea bass and rice', '400 g basmati rice', 'sea salt', 'freshly ground black pepper', '4 x 170 g sea bass fillets , from sustainable sources, ask your fishmonger, pinboned and skin scored', '1 handful sugar snap peas or mangetouts', '1 bunch spring onions , outer leaves discarded, trimmed and finely sliced', '1-2 fresh red chillies , deseeded and finely sliced', '1 lime , quartered']",https://www.jamieoliver.com/recipes/fish-recipes/steamed-thai-style-sea-bass-and-rice/
Steamed Asian sea bass in the bag,lime lemon grass chopped garlic chopped kikkoman soy lime zested bass fillet about each egg wineglass sake,"['6 lime leaves', '1-2 sticks lemon grass , chopped', '1 clove garlic , finely sliced', '1-2 red chillies , to taste, seeded and chopped', '1 small tablespoon freshly grated ginger', '1 handful coriander , leaves picked and stalks reserved, plus extra to serve', '1 tablespoon Kikkoman low-salt soy sauce', '1 lime , zested and halved', '2 tablespoons olive oil', '2 thick sea bass fillets , from sustainable sources, ask your fishmonger, about 200g each', '1 free-range egg white', '1 small wineglass sake']",https://www.jamieoliver.com/recipes/fish-recipes/steamed-asian-sea-bass-in-the-bag/
"Steak, Guinness & cheese pie",onion garlic carrot celery field mushroom brisket stewing beef guinness flour cheddar cheese puff pastry egg,"['3 red onions', '3 cloves of garlic', '2 carrots', '2 sticks of celery', '4 field mushrooms', 'a few sprigs of rosemary', 'olive oil', '1 kg quality brisket or stewing beef , cut into 2cm cubes', '440 ml Guinness (no lager, please!)', '2 heaped tablespoons plain flour , plus extra for dusting', '140 g Cheddar cheese', '170 g puff pastry', '1 large egg']",https://www.jamieoliver.com/recipes/beef-recipes/steak-guinness-cheese-pie/
Squash and ricotta pasta bake,butternut squash chopped garlic chopped chopped tomato penne ricotta cheese vegetable stock mozzarella ball parmesan cheese,"['1 butternut squash , peeled, deseeded and chopped into 2.5cm pieces', 'olive oil', '2 cloves of garlic , peeled and finely sliced', '1 bunch of fresh basil , leaves picked, stalks finely chopped', '1 x 400 g tins of chopped tomatoes', 'sea salt', '500 g dried penne', 'freshly ground black pepper', '3 tablespoons ricotta cheese', '750 ml organic vegetable stock', '150 g mozzarella ball', '1 handful Parmesan cheese , freshly grated', '2 sprigs fresh sage , leaves picked']",https://www.jamieoliver.com/recipes/pasta-recipes/squash-and-ricotta-pasta-bake/
